{
  "registry_id": "robotactile_univtac_tasks_v1",
  "semantic_version": "1.0",
  "upstream_repository": "https://github.com/destinyls/UniVTAC",
  "upstream_commit": "05bcd3edb92237107efa40105292a24f1a9fd761",
  "runtime": {
    "action_spec": "qpos8_next_step",
    "action_mode": "qpos",
    "force": true,
    "sim_hz": 120,
    "decimation": 1,
    "physics_steps_per_action": 1,
    "canonical_joint_names": [
      "panda_joint1",
      "panda_joint2",
      "panda_joint3",
      "panda_joint4",
      "panda_joint5",
      "panda_joint6",
      "panda_joint7",
      "panda_finger_joint1",
      "panda_finger_joint2"
    ],
    "action_lower_bounds": [
      -2.8973,
      -1.7628,
      -2.8973,
      -3.0718,
      -2.8973,
      -0.0175,
      -2.8973,
      0.0
    ],
    "action_upper_bounds": [
      2.8973,
      1.7628,
      2.8973,
      -0.0698,
      2.8973,
      3.7525,
      2.8973,
      0.039
    ],
    "head_shape": [270, 480, 3],
    "wrist_shape": [270, 480, 3],
    "tactile_rgb_shape": [240, 320, 3],
    "tactile_depth_shape": [240, 320]
  },
  "aliases": {
    "head_camera": "head",
    "wrist_camera": "wrist",
    "left_tactile": "left_tactile",
    "right_tactile": "right_tactile",
    "left_physical_source_id": "univtac-left-gsmini-sim-v1",
    "right_physical_source_id": "univtac-right-gsmini-sim-v1",
    "sensor_type": "gsmini",
    "far_plane_mm": 34.0,
    "calibration_id": "univtac-gsmini-sim-calibration-v1",
    "calibration_config_sha256": "f62283f77af986ab30f4b68ff7f746e772c3c2455e49efed297ef24b777d6fa9",
    "tactile_payload": "rgb_marker"
  },
  "phase_tracker": {
    "on_threshold_mm": 0.8,
    "off_threshold_mm": 0.3
  },
  "tasks": [
    {
      "task_id": "grasp_classify",
      "prompt_id": "robotactile.grasp_classify.v1",
      "prompt": "Classify the grasped object's tactile response and maintain a stable grasp.",
      "module_name": "envs.grasp_classify",
      "class_name": "Task",
      "success_predicate_id": "univtac-upstream-05bcd3ed.grasp_classify.check_success.v1",
      "task_source_sha256": "9596a819c97e3ac53188da10683b6f3be60cc573067f572f3e5dbe1d7e29d48c",
      "action_horizon": 300,
      "early_stop_capable": false,
      "predicate_note": "Frozen upstream check_success behavior without benchmark-side correction."
    },
    {
      "task_id": "insert_HDMI",
      "prompt_id": "robotactile.insert_HDMI.v1",
      "prompt": "Insert the HDMI plug fully into the matching socket.",
      "module_name": "envs.insert_HDMI",
      "class_name": "Task",
      "success_predicate_id": "univtac-upstream-05bcd3ed.insert_HDMI.check_success.v1",
      "task_source_sha256": "6b612905275aa401983133ab9b58f5d38dc76975fb9ef422673a37036fbdf2eb",
      "action_horizon": 600,
      "early_stop_capable": false,
      "predicate_note": "Frozen upstream predicate with its x-coordinate omission; characterized, not benchmark-corrected."
    },
    {
      "task_id": "insert_hole",
      "prompt_id": "robotactile.insert_hole.v1",
      "prompt": "Align the object with the hole and insert it to the target depth.",
      "module_name": "envs.insert_hole",
      "class_name": "Task",
      "success_predicate_id": "univtac-upstream-05bcd3ed.insert_hole.check_success.v1",
      "task_source_sha256": "8b199327e549f979076e03082b0a8883cc71de351c90c30901c6af6c432ce1cb",
      "action_horizon": 300,
      "early_stop_capable": true,
      "predicate_note": "Frozen upstream check_success behavior without benchmark-side correction."
    },
    {
      "task_id": "insert_tube",
      "prompt_id": "robotactile.insert_tube.v1",
      "prompt": "Align the tube and insert it into the target opening.",
      "module_name": "envs.insert_tube",
      "class_name": "Task",
      "success_predicate_id": "univtac-upstream-05bcd3ed.insert_tube.check_success.v1",
      "task_source_sha256": "dca64e9232f459a5e3019eb3ba92c2b31e8aca4d64182c97e291b6575f5f7353",
      "action_horizon": 300,
      "early_stop_capable": true,
      "predicate_note": "Frozen upstream predicate with signed offsets in its planar check; characterized, not benchmark-corrected."
    },
    {
      "task_id": "lift_bottle",
      "prompt_id": "robotactile.lift_bottle.v1",
      "prompt": "Grasp the bottle securely and lift it above the success height.",
      "module_name": "envs.lift_bottle",
      "class_name": "Task",
      "success_predicate_id": "univtac-upstream-05bcd3ed.lift_bottle.check_success.v1",
      "task_source_sha256": "46b9a691ec850004ffe2d226aa6e7e4ab84c7c2f1ab1548819f235b86f1e993c",
      "action_horizon": 500,
      "early_stop_capable": true,
      "predicate_note": "Frozen upstream check_success behavior without benchmark-side correction."
    },
    {
      "task_id": "lift_can",
      "prompt_id": "robotactile.lift_can.v1",
      "prompt": "Grasp the can securely and lift it above the success height.",
      "module_name": "envs.lift_can",
      "class_name": "Task",
      "success_predicate_id": "univtac-upstream-05bcd3ed.lift_can.check_success.v1",
      "task_source_sha256": "2e6327443a895555675b1a5caab7e33d8f6dc99ef5b9328c0b7282b922aebffd",
      "action_horizon": 300,
      "early_stop_capable": true,
      "predicate_note": "Frozen upstream check_success behavior without benchmark-side correction."
    },
    {
      "task_id": "pull_out_key",
      "prompt_id": "robotactile.pull_out_key.v1",
      "prompt": "Grasp the key and pull it completely out of the lock.",
      "module_name": "envs.pull_out_key",
      "class_name": "Task",
      "success_predicate_id": "univtac-upstream-05bcd3ed.pull_out_key.check_success.v1",
      "task_source_sha256": "d77e3a36df9a3c9aa4e445ac2f78f88f8a76d857d277801982a9b78bba8614be",
      "action_horizon": 300,
      "early_stop_capable": true,
      "predicate_note": "Frozen upstream check_success behavior without benchmark-side correction."
    },
    {
      "task_id": "put_bottle_in_shelf",
      "prompt_id": "robotactile.put_bottle_in_shelf.v1",
      "prompt": "Place the bottle fully inside the target shelf compartment.",
      "module_name": "envs.put_bottle_in_shelf",
      "class_name": "Task",
      "success_predicate_id": "univtac-upstream-05bcd3ed.put_bottle_in_shelf.check_success.v1",
      "task_source_sha256": "f6e17433d0310c12793e1cb64d58f4c3a3e376329c85384e0797ddad6f8c8d4b",
      "action_horizon": 300,
      "early_stop_capable": true,
      "predicate_note": "Frozen upstream check_success behavior without benchmark-side correction."
    }
  ]
}
